{
  "$schema": "./montage_display.schema.json",
  "name": "double_banana_paired",
  "description": "Alternative double-banana layout that interleaves left/right chains so a clinician can compare hemispheres at the same vertical position. Left temporal sits directly above right temporal, then left parasagittal above right parasagittal, then midline at the bottom. Spacers are placed between each left->right transition.",
  "derivation": {
    "type": "symbolic",
    "reversed_polarity": true,
    "channels": [
      {
        "label": "Fp1-F7",
        "diffpair": [
          "Fp1",
          "F7"
        ]
      },
      {
        "label": "F7-T3",
        "diffpair": [
          "F7",
          "T3"
        ]
      },
      {
        "label": "T3-T5",
        "diffpair": [
          "T3",
          "T5"
        ]
      },
      {
        "label": "T5-O1",
        "diffpair": [
          "T5",
          "O1"
        ]
      },
      {
        "label": "Fp2-F8",
        "diffpair": [
          "Fp2",
          "F8"
        ]
      },
      {
        "label": "F8-T4",
        "diffpair": [
          "F8",
          "T4"
        ]
      },
      {
        "label": "T4-T6",
        "diffpair": [
          "T4",
          "T6"
        ]
      },
      {
        "label": "T6-O2",
        "diffpair": [
          "T6",
          "O2"
        ]
      },
      {
        "label": "Fp1-F3",
        "diffpair": [
          "Fp1",
          "F3"
        ]
      },
      {
        "label": "F3-C3",
        "diffpair": [
          "F3",
          "C3"
        ]
      },
      {
        "label": "C3-P3",
        "diffpair": [
          "C3",
          "P3"
        ]
      },
      {
        "label": "P3-O1",
        "diffpair": [
          "P3",
          "O1"
        ]
      },
      {
        "label": "Fp2-F4",
        "diffpair": [
          "Fp2",
          "F4"
        ]
      },
      {
        "label": "F4-C4",
        "diffpair": [
          "F4",
          "C4"
        ]
      },
      {
        "label": "C4-P4",
        "diffpair": [
          "C4",
          "P4"
        ]
      },
      {
        "label": "P4-O2",
        "diffpair": [
          "P4",
          "O2"
        ]
      },
      {
        "label": "Fz-Cz",
        "diffpair": [
          "Fz",
          "Cz"
        ]
      },
      {
        "label": "Cz-Pz",
        "diffpair": [
          "Cz",
          "Pz"
        ]
      }
    ]
  },
  "groups": [
    {
      "name": "left_temporal",
      "channels": [
        "Fp1-F7",
        "F7-T3",
        "T3-T5",
        "T5-O1"
      ],
      "color": "#1f4e79",
      "gap_after_mm": 4.0
    },
    {
      "name": "right_temporal",
      "channels": [
        "Fp2-F8",
        "F8-T4",
        "T4-T6",
        "T6-O2"
      ],
      "color": "#a8323e",
      "gap_after_mm": 6.0
    },
    {
      "name": "left_parasagittal",
      "channels": [
        "Fp1-F3",
        "F3-C3",
        "C3-P3",
        "P3-O1"
      ],
      "color": "#1f4e79",
      "gap_after_mm": 4.0
    },
    {
      "name": "right_parasagittal",
      "channels": [
        "Fp2-F4",
        "F4-C4",
        "C4-P4",
        "P4-O2"
      ],
      "color": "#a8323e",
      "gap_after_mm": 6.0
    },
    {
      "name": "midline",
      "channels": [
        "Fz-Cz",
        "Cz-Pz"
      ],
      "color": "#000000",
      "gap_after_mm": 0.0
    }
  ],
  "channel_overrides": {}
}
